05-435,Advanced Fabrication Techniques for HCI,Fall,12,"This course will consider how new fabrication techniques such as 3D printing, laser cutting, CNC machining and related computer controlled technologies can be applied to problems in Human-Computer Interaction.  Each offering will concentrate on a particular application domain for its projects. This year the course will consider assistive technology. This course will be very hands-on and skills-oriented, with the goal of teaching students the skills necessary to apply these technologies to HCI problems such as rapid prototyping of new device concepts. To this end?   Every student in this course will build and take home a 3D printer.  (There will be $400-$500 cost associated with this course to make that possible. Details on this are still to be determined.)"
05-439,The Big Data Pipeline: Collecting and Using Big Data for Interactive Systems,Spring,12,This course covers techniques and technologies for creating data driven interfaces. You will learn about the entire data pipeline from sensing to cleaning data to different forms of analysis and computation. Course Website: http://data.cmubi.org
05-440,Interaction Techniques,Intermittent,12,"This course will provide a comprehensive study of the many ways to interact with computers and computerized devices. An ""interaction technique"" starts when the user does something that causes an electronic device to respond, and includes the direct feedback from the device to the user. Examples include physical buttons and switches, on-screen menus and scroll bars operated by a mouse, touch screen widgets and gestures such as flick-to-scroll, text entry on computers or touch screens, consumer electronic controls such as remote controls, game controllers, and adaptations of all of these for people with disabilities. We will start with a history of the invention and development of these techniques, discuss the various options used today, and continue on to the future with the latest research on interaction techniques presented at conferences such as ACM CHI and UIST. Guest lectures from inventors of interaction techniques are planned. Students will have a choice for final projects that can focus on historical or novel interaction techniques. For example, one option will be to create a novel technique, perform a user study of it, and write a paper about the result, which may be suitable for conference submission. Another option will be to investigate and write a paper or make a video about the history and various previous designs for widely used interaction techniques, possibly including an interview with the inventor(s). Course Website: http://www.cs.cmu.edu/~bam/uicourse/05440inter/"
05-452,Service Design,Fall,12,"In this course, we will collectively define and study services and product service systems, and learn the basics of designing them. We will do this through lectures, studio projects, and verbal and written exposition. Classwork will be done individually and in teams."
05-499,Special Topics in HCI,Fall and Spring,12,"Special Topics in HCI is an opportunity for students interested in HCI to gain a deeper understanding of a specific area in this field. Each class is designed to cover an emerging research area within HCI, from designing large-scale peer learning systems to designing games around audience agency. All sections will help students: (1) build a more comprehensive understanding of an area of study within HCI, (2) work closely with faculty and peers to create mini-projects or team assignments that help students master the course material, (3) explore evidence-based research methods and techniques in HCI.    Sections will vary in topic and often change from semester to semester. Because of this, students can take multiple sections, as they are individual classes. Undergraduate sections are listed as 499 and graduate sections are listed as 899.   For descriptions of specific sections for this academic year, visit the ""Courses"" section on the Human-Computer Interaction Institute website: http://hcii.cmu.edu/academics/coursesCourse Website: http://www.hcii.cmu.edu/academics/courses"
05-540,Rapid Prototyping of Computer Systems,Spring,12,"This is a project-oriented course, which will deal with all four aspects of project development: the application, the artifact, the computer-aided design environment, and the physical prototyping facilities. The class consists of students from different disciplines who must synthesize and implement a system in a short period of time. Upon completion of this course the student will be able to: generate systems specifications from a perceived need; partition functionality between hardware and software; produce interface specifications for a system composed of numerous subsystems; use computer-aided development tools; fabricate, integrate, and debug a hardware/software system; and evaluate the system in the context of an end user application.  The class consists of students from different disciplines who must synthesize and implement a system in a short period of time. Course Website: http://www.hcii.cmu.edu/courses/rapid-prototyping-computer-systems"
05-571,Undergraduate Project in HCI,Spring,12,"Experiential learning is a key component of the MHCI program. Through a substantial team project, students apply classroom knowledge in analysis and evaluation, implementation and design, and develop skills working in multidisciplinary teams.  Student teams work with Carnegie Mellon University-based clients or external clients to iteratively design, build and test a software application which people directly use.Prerequisites: 05-431 Min. grade B or 05-610 Min. grade B or 05-630 Min. grade B or 05-631 Min. grade B or 05-410 Min. grade B or 05-430 Min. grade B Course Website: http://www.hcii.cmu.edu/courses/undergraduate-project-hci"
05-589,Independent Study in HCI-UG,All Semesters,0,"In collaboration with and with the permission of the professor, undergraduate students may engage in independent project work on any number of research projects sponsored by faculty. Students must complete an Independent Study Proposal, negotiate the number of units to be earned, complete a contract, and present a tangible deliverable.  The Undergraduate Program Advisor's signature is required for HCI undergraduate-level Independent Study courses."
05-600,HCI Pro Seminar,Fall,6,"Students will attend weekly HCII Seminar Series of talks given by national leaders in the field of Human-Conmputer Interaction, attend communication workshops and conflict management workshops. Course Website: http://www.hcii.cs.cmu.edu"
05-610,User-Centered Research and Evaluation,Fall,12,"This course provides and overview and introduction to the field of human-computer interaction (HCI). It introduces students to tools, techniques, and sources of information about HCI and provides a systematic approach to design. The course increases awareness of good and bad design through observation of existing technology, and teaches the basic skills of task analysis, and analytic and empirical evaluation methods. This is a companion course to courses in visual design (05-650) and software implementation (05-630, 05-631).  This course is NOT open to students outside of the HCI major. Course Website: http://www.hcii.cs.cmu.edu"
05-650,Interaction Design Studio II,Spring,12,"This course follows Interaction Design Fundamentals (05-651). Students are expected to apply what they have learned about design thinking and methodologies as a starting point for all assignments. Students will work in teams to perform guerrilla research, synthesize data, and consider the needs of multiple stakeholders in their design of mobile services and other intelligent systems. Design concepts go beyond user interfaces to include sensors, controls, and ubiquitous computing. Emphasis is placed on the quality of the students ideas and their ability to give form to their design concepts. By completing and presenting their work, students will gain skills related to professional UX design practice.Prerequisites: 05-651 or 51-761 or 51-262 or 51-261Course Website: http://www.hcii.cmu.edu/courses/interaction-design-studio"
05-651,Interaction Design Studio 1,Fall,12,"This studio course introduces students to design thinking and the basic practices of interaction design. We follow a human-centered design process that includes research, concept generation, prototyping, and refinement. Students must work effectively as individuals and in small teams to design mobile information systems and other interactive experiences. Assignments approach design on three levels: specific user interactions, contexts of use, and larger systems. Students will become familiar with design methodologies such as sketching, storyboarding, wire framing, prototyping, etc. No coding is required. This course serves as a prerequisite for Interaction Design Studio (05-650)."
05-823,E-Learning Design Principles and Methods,Fall,12,"This course is about e-learning design principles, the evidence and theory behind them, and how to apply these principles to develop effective educational technologies. It is organized around the book ""e-Learning and the Science of Instruction: Proven Guidelines for Consumers and Designers of Multimedia Learning"" by Clark & Mayer with further readings drawn from cognitive science, educational psychology, and human-computer interaction. You will learn design principles 1) for combining words, audio, and graphics in multimedia instruction, 2) for combining examples, explanations, practice and feedback in online support for learning by doing, and 3) for balancing learner versus system control and supporting student metacognition. You will read about the experiments that support these design principles, see examples of how to design such experiments, and practice applying the principles in educational technology development. Course Website: http://www.learnlab.org/research/wiki/index.php/E-learning_Design_Principles_2013#Course_Details"
05-840,Tools for Online Learning,Fall,12,This course is for students in the METALS program.
08-200,Ethics and Policy Issues in Computing,Spring,9,"Should autonomous robots make life and death decisions on their own?  Should we allow them to select a target and launch weapons? To diagnose injuries and perform surgery when human doctors are not around?  Who should be permitted to observe you, find out who your friends are, what you do and say with them, what you buy, and where you go?  Do social media and personalized search restrict our intellectual horizons?  Do we live in polarizing information bubbles, just hearing echoes of what we already know and believe?  As computing technology becomes ever more pervasive and sophisticated, we are presented with an escalating barrage of decisions about who, how, when, and for what purposes technology should be used.  This course will provide an intellectual framework for discussing these pressing issues of our time, as we shape the technologies that in turn shape us.  We will seek insight through reading, discussion, guest lectures, and debates.  Students will also undertake an analysis of a relevant issue of their choice, developing their own position, and acquiring the research skills needed to lend depth to their thinking.  The course will enhance students' ability to think clearly about contentious technology choices, formulate smart positions, and support their views with winning arguments."
08-202,Computational Approaches to Social Complexity,Spring,9,"Everything is connected!  From small groups to economic markets to global societies - interactions  among people, organizations, technology, and policies lead to complex  systems.  These connected systems cannot be described with simple  equations but rather with networks, non-linearities and tipping points.  This course covers a set of computational approaches to analyzing and  understanding the dynamics of the social world.  Techniques include data  capture, social network analysis, advanced information visualization,  and agent based simulation.  Students will engage in hands-on projects  learning these techniques to explain and predict social changes arising  from the complexity of everyday life."
08-302,Introduction to Network Science,Fall,9,"Everything is connected - from your friends, to everyone at CMU, to economic markets, disease outbreaks, and global societies. Relationships and flows of information among people and organizations form complex systems that are the fundamental structures governing our world, yet defy easy understanding. To analyze these interconnected systems we must turn to network science. This course covers the mathematical and graph theoretical foundations of network science, as well as theories and algorithms for analyzing and visualizing structures and dynamics of networked systems. Topics covered in this class include: centrality metrics, community detection, diffusion processes, scale-free and small-world networks, social media analytics, and network visualization. A special emphasis is on algorithmic challenges and solutions in the context of big data networks. Students will engage in hands-on projects learning network science, solidifying their mathematical and graph theory knowledge and learning how to apply it to a range of real world problems. This course is open to students in all majors who have earned a C or better in 15-151 or 21-127.Prerequisites: 21-127 Min. grade C or 15-151 Min. grade C"
08-303,"Special Topic: Cryptocurrencies, Blockchains and Applications",Spring,0,"Cryptocurrencies such as Bitcoin have gained large popularity in recent years, in no small part due to the fantastic potential applications they could facilitate. This course will first provide an overview of the technological mechanisms behind cryptocurrencies and distributed consensus and distributed ledgers (""blockchains""), introducing along the way the necessary cryptographic tools. It will then focus on more advanced blockchain applications, such as ""smart contracts,"" that is, contracts written as code. Finally, the course will also introduce some of the legal and policy questions surrounding cryptocurrencies.  Prerequisites:  15-213 or equivalent strongly recommended"
08-340,Green Computing,Spring,9,"Energy is a key societal resource. However, our energy usage is rising at an alarming rate and therefore it has become critical to manage its consumption more efficiently for long term sustainability. This course introduces students to the exciting area of ""Green Computing"", and is organizationally divided into two tracks. The first track is ""Energy-Efficient Computing"", which considers the state of the art techniques for improving the energy efficiency of mobile devices, to laptop and desktop class computers and finally to data centers. We will cover energy efficiency across the hardware/software stack, starting from the individual components like processors and radio interfaces to system level architectures and optimizations. The second track is ""Applying Computing towards Sustainability"", covering topics that leverage computing to reduce the energy footprint of our society. In particular, we will focus on Smart Buildings and the Smart Grid, covering topics such as sensing, modeling and controlling the energy usage of buildings, new operating systems or software stacks for the smart infrastructure, as well as the privacy and security issues with the new ""internet of things"". The goal of this course is to help students acquire some of the knowledge and the skills needed to do research in this space of ""Green Computing"".  Although the course is listed within SCS, it should be of interest to students in several departments, including ECE, MechE, CEE, EPP and Architecture. Course Website: http://www.synergylabs.org/yuvraj/courses/08-840/"
08-421,Building user-focused sensing systems,Spring,12,"These days we are surrounded by sensing and computation. Smart devices, such as smartphones, smartwatches, are packed with sensors. While they are already very useful devices, we have only started to scratch the surface here. The aim of this class will be to introduce the students to building and understanding smart sensing devices. The course will include discussion into contribution of various fields, including human-computer interaction, embedded computing, computer vision, distributed systems, machine learning, signal processing, security, and privacy. We will discuss how these various disciplines are coming together to form an end-to-end system that generates useful and user-actionable data. We will take a hands-on approach towards building and evaluating these systems. The students will gain practical experience in developing sensing systems in different application domains, such as activity recognition, health sensing, gestural interaction, etc. You will learn about embedded systems and understand the advantages and limitations of different platforms. You will learn about sensors and how to interface them with the real world to be able to get useful and actionable data. You will learn how to build a network of sensors that can communicate with each other. You will also learn about storing the sensor data for visualization, analysis and presentation both locally and to the cloud.   The course will be a combination of lectures, tutorials, class discussions, and demonstrations. Students will be evaluated based on 5 mini-projects/assignments, class participation, weekly reading summaries, and a final project. All hardware resources will be provided to the students and they will be given an option to take their final prototypes with them for the cost of the hardware components. The only requirement for the class is that the students should have reasonable programming experience and an interest in tinkering."
08-530,Pervasive and Ubiquitous Computing,Fall,12,"The aim of the class will be to explore the area of Ubiquitous Computing (ubicomp) and allow students to work on a variety of small technology projects.  Students will be exposed to the basics of building ubicomp systems, emerging new research topics, and advanced prototyping techniques.  This course will focus more on class discussions and hands on demonstrations, while formal lectures will be conducted only as needed.  Students will be evaluated on their class participation, reading summaries, and mini projects."
08-532,Law of Computer Technology,Fall,9,"The Law of Computer Technology  A survey of how legislatures and courts cope with rapidly advancing computer technologies and how scientific information is presented to, and evaluated by, civil authorities.  The course is also an introduction to the legal process generally and the interaction between the legal system and technology organizations.  Topics include: patents, copyrights in a networked world, law of the Internet, free speech, data security, technology regulation, international law, and transborder crime.  Open to juniors, seniors and graduate students in any school.  Open to sophomores by permission of the instructor.  Prerequisites: none."
08-533,"Privacy Policy, Technology and Law",Fall and Spring,9,"This course focuses on policy issues related to privacy from the perspectives of governments, organizations, and individuals. We will begin with a historical and philosophical study of privacy and then explore recent public policy issues. We will examine the privacy protections provided by laws and regulations, as well as the way technology can be used to protect privacy. We will emphasize technology-related privacy concerns and mitigation, for example: social networks, smartphones, behavioral advertising (and tools to prevent targeted advertising and tracking), anonymous communication systems, big data, and drones.  This is part of a series of courses offered as part of the MSIT-Privacy Engineering masters program. These courses may be taken in any order or simultaneously. Foundations of Privacy (Fall semester) offers more in-depth coverage of technologies and algorithms used to reason about and protect privacy. Engineering Privacy in Software (Spring semester) focuses on the methods and tools needed to design systems for privacy.  This course is intended primarily for graduate students and advanced undergraduate students with some technical background. Programming skills are not required. 8-733, 19-608, and 95-818 are 12-unit courses for PhD students. Students enrolled under these course numbers will have extra assignments and will be expected to do a project suitable for publication. 8-533 is a 9-unit course for undergraduate students. Masters students may register for any of the course numbers permitted by their program. This course will include a lot of reading, writing, and class discussion. Students will be able to tailor their assignments to their skills and interests. However, all students will be expected to do some writing and some technical work. Course Website: http://cups.cs.cmu.edu/courses/privpolawtech.html"
08-540,Green Computing,Spring,9,"Energy is a key societal resource. However, our energy usage is rising at an alarming rate and therefore it has become critical to manage its consumption more efficiently for long term sustainability. This course introduces students to the exciting area of ""Green Computing"", and is organizationally divided into two tracks. The first track is ""Energy-Efficient Computing"", which considers the state of the art techniques for improving the energy efficiency of mobile devices, to laptop and desktop class computers and finally to data centers. We will cover energy efficiency across the hardware/software stack, starting from the individual components like processors and radio interfaces to system level architectures and optimizations. The second track is ""Applying Computing towards Sustainability"", covering topics that leverage computing to reduce the energy footprint of our society. In particular, we will focus on Smart Buildings and the Smart Grid, covering topics such as sensing, modeling and controlling the energy usage of buildings, new operating systems or software stacks for the smart infrastructure, as well as the privacy and security issues with the new ""internet of things"". The goal of this course is to help students acquire some of the knowledge and the skills needed to do research in this space of ""Green Computing"".  Although the course is listed within SCS, it should be of interest to students in several departments, including ECE, MechE, CEE, EPP and Architecture. Course Website: http://www.synergylabs.org/yuvraj/courses/08-840/"
08-541,Hardware and Software Systems for Smart Homes and Buildings,Spring,9,"Smart automation in the home and buildings hold tremendous promise to enhance the quality of our lives and improving energy efficiency. In this course we will take a hand on approach towards building hardware and software systems within the context of these emerging smart homes and smart building domains. You will learn about embedded systems and how to choose the appropriate one for different smart home projects, including understanding the advantages and limitations of such platforms. You will learn about sensors and how to interface them with the real world to be able to get useful and actionable data. You will learn about designing systems from ground up, including schematic and PCB layouts. You will learn about different radio technologies, so that you can build a network of sensors that can communicate with each other. You will also learn about storing the sensor data for visualization, analysis and presentation both locally and to the cloud. The course will comprise of hands on exercises, which build upon each other as the course progresses through the semester. We will likely use an embedded platform such as the Rasberry PI or the BeagleBone Black (cost between $75 and $100) and each student will be expected to buy one of these platforms to use throughout the semester. From time to time we will also discuss latest research papers and case studies on topics related to smart home and buildings, with the focus towards deployed systems. The course grade will be computed based on the homework and mini-project assignments, class presentations and a semester long course project. It is expected that students will have some programming background, are excited to take on hands on projects, and want to learn how to build end to end systems for smart homes. As a side effect, perhaps some of your ideas will lead to the next NEST (sold for $3.2B in 2014!)."
08-671,Java for Application Programmers,Fall and Spring,6,"This course provides an intensive exploration of computer programming in the Java Language for Masters students who have had some prior, but perhaps limited, programming experience in Java or in some other programming language. The course starts with a review of the fundamental topics of programming in Java (data types, operators, control structures) along with discussions of object oriented programming (classes, instances, and class hierarchies). After covering the basics we move on using Java to cover simple graphical user interfaces (using Swing), file I/O, concurrency (i.e., threads), network I/O (HTTP), simple data structures (lists and maps).  Students are required to have a reasonably modern laptop computer on which they will need to install the Java software used for this course."
