15-359,Probability and Computing,Intermittent,12,"Probability theory has become indispensable in computer science.  In  areas such as artificial intelligence and computer science theory,  probabilistic methods and ideas based on randomization are central.  In other areas such as networks and systems, probability is becoming  an increasingly useful framework for handling uncertainty and modeling  the patterns of data that occur in complex systems.  This course gives  an introduction to probability as it is used in computer science  theory and practice, drawing on applications and current research  developments as motivation and context. Topics include combinatorial  probability and random graphs, heavy tail distributions, concentration  inequalities, various randomized algorithms, sampling random variables  and computer simulation, and Markov chains and their many  applications, from Web search engines to models of network protocols.  The course will assume familiarity with 3-D calculus and linear  algebra.Prerequisites: 15-251 Min. grade C and 21-259 and 21-241Course Website: http://www.cs.cmu.edu/~harchol/15359/class.html"
15-365,Experimental Animation,Spring,12,"[IDeATe course] This class will explore animation from the student's perspective with a sense of investigation toward both form and content. Topics in the class will include non-linear narrative, visual music, puppet and non-traditional materials, manipulation of motion and performance capture data, immersive environments.Prerequisite: 15-213 Min. grade C"
15-369,Special Topics: Perceptual Computing,Intermittent,9,"This course is ONLY offered at Carnegie Mellon in Qatar.  What can today's computers see, hear, and feel?  This project-based course is designed to provide students exposure to the state-of-the-art in machine perception and the algorithms behind them.  Student groups will design a perceptual computing project around Intel's Creative Camera or Microsoft's Kinect. Students will learn to use tools in face detection and recognition, hand and finger tracking, and speech recognition, along with algorithms to make decisions based on these input modalities.Prerequisites: 15-122 and 21-241"
15-381,Artificial Intelligence: Representation and Problem Solving,Fall,9,"This course is about the theory and practice of Artificial Intelligence. We will study modern techniques for computers to represent task-relevant information and make intelligent (i.e. satisficing or optimal) decisions towards the achievement of goals. The search and problem solving methods are applicable throughout a large range of industrial, civil, medical, financial, robotic, and information systems.  We will investigate questions about AI systems such as: how to represent knowledge, how to effectively generate appropriate sequences of actions and how to search among alternatives to find optimal or near-optimal solutions.  We will also explore how to deal with uncertainty in the world, how to learn from experience, and how to learn decision rules from data.  We expect that by the end of the course students will have a thorough understanding of the algorithmic foundations of AI, how probability and AI are closely interrelated, and how automated agents learn.  We also expect students to acquire a strong appreciation of the big-picture aspects of developing fully autonomous intelligent agents.  Other lectures will introduce additional aspects of AI, including natural language processing, web-based search engines, industrial applications, autonomous robotics, and economic/game-theoretic decision making.Prerequisite: 15-122 Min. grade C"
15-383,Introduction to Text Processing,Fall,6,"Text processing is a mini-course about text basic techniques of processing human language in text format.  The course has theoretical and hands-on components. In the theoretical component, the course will discuss challenges in processing human languages, and review the  basics of statistics and probability theory and their application to language problems.  In the hands-on part, students will learn about Python programming and use it to process large volumes of text using various  techniques. The processing will range from simple steps such as tokenization and part-of-speech tagging to full-fledged  applications such as  statistical machine translation,  search and document/topic classification.  The course is suited for junior and senior students in CS and IS.Prerequisites: 15-122 Min. grade C or 15-121 Min. grade C"
15-385,Introduction to Computer Vision,Spring,6,"An introduction to the science and engineering of computer vision,  i.e.  the analysis of the patterns in visual images with the view to  understanding the objects and processes in the world that generate  them.  Major topics include image formation and sensing, fourier  analysis, edge and contour detection, inference of depth, shape and  motion, classification, recognition, tracking, and active vision. The  emphasis is on the learning of fundamental mathematical concepts and  techniques and applying them to solve real vision problems. The  discussion will also include comparison with human and animal vision  from psychological and biological perspectives. Students will learn to  think mathematically and develop skills in translating ideas and  mathematical thoughts into programs to solve real vision problems.Prerequisites: 15-122 Min. grade C and 21-241"
15-386,Neural Computation,Spring,9,"Computational neuroscience is an interdisciplinary science that seeks to understand how the brain computes  to achieve  natural intelligence.  It seeks to understand the computational principles and mechanisms of intelligent behaviors and mental abilities ?such as perception, language, motor control, and learning ?by building artificial systems and computational models with the same capabilities. This course explores how neurons encode and process information, adapt and learn, communicate, cooperate, compete and compute at the individual level as well as at the levels of networks and systems. It will introduce basic concepts in computational modeling, information theory, signal processing, system analysis, statistical and probabilistic inference. Concrete examples will be drawn from the visual system and the motor systems,  and studied from computational, psychological and biological perspectives. Students will learn to perform computational experiments using Matlab and quantitative studies of neurons and neuronal networks.Prerequisites: 15-112 Min. grade C and 21-122"
15-387,Computational Perception,Fall,9,"In this course, we will first cover the biological and psychological foundational knowledge of biological perceptual systems, and then apply computational thinking to investigate the principles and mechanisms underlying natural perception. The course will focus on vision this year, but will also touch upon other sensory modalities. You will learn how to reason scientifically and computationally about problems and issues in perception, how to extract the essential computational properties of those abstract ideas, and finally how to convert these into explicit mathematical models and computational algorithms. Topics include perceptual representation and inference, perceptual organization, perceptual constancy, object recognition, learning and scene analysis. Prerequisites: First year college calculus, some basic knowledge of linear algebra and probability and some programming experience are desirable.Prerequisites: 21-241 and 21-122 and 15-112 Min. grade C"
15-388,Practical Data Science,Intermittent,9,"Data science is the study and practice of how we can extract insight and knowledge from large amounts of data. This course provides a practical introduction to the ""full stack"" of data science analysis, including data collection and processing, data visualization and presentation, statistical model building using machine learning, and big data techniques for scaling these methods. Topics covered include: collecting and processing data using relational methods, time series approaches, graph and network models, free text analysis, and spatial geographic methods; analyzing the data using a variety of statistical and machine learning methods include linear and non-linear regression and classification, unsupervised learning and anomaly detection, plus advanced machine learning methods like kernel approaches, boosting, or deep learning; visualizing and presenting data, particularly focusing the case of high-dimensional data; and applying these methods to big data settings, where multiple machines and distributed computation are needed to fully leverage the data.Students will complete weekly programming homework that emphasize practical understanding of the methods described in the course. In addition, students will develop a tutorial on an advanced topic, and will complete a group project that applies these data science techniques to a practical application chosen by the team; these two longer assignments will be done in lieu of a midterm or final.Prerequisite: 15-112 Min. grade C Course Website: http://www.datasciencecourse.org"
15-390,Entrepreneurship for Computer Science,Fall,9,"This course is designed to develop skills related to entrepreneurship and innovation for non-business undergraduate and graduate students in the School of Computer Science.  The course assumes no background courses in business and is appropriate for those who are interested in bringing innovations to market either through new companies or existing companies.   The course provides an overview of entrepreneurship and innovation, develops an entrepreneurial frame of mind, and provides a framework for learning the rudiments of how to generate ideas.  Students come up with or are presented with potential ideas and learn how to develop these ideas into opportunities, and to explore their potential for becoming viable businesses.  They learn how to do market research, to develop go-to-market strategies, value propositions and to differentiate their products or services from potential competitors.  The focus is on understanding and developing strategies for approaching the key elements of the entrepreneurial process...opportunity, resources and team. The course consists of a balance of lectures, case studies and encounters with entrepreneurs, investors and business professionals.  The students are exposed to financial and intellectual property issues, and encounter a real world perspective on entrepreneurship, innovation and leadership.  The output of the course is a mini-business plan or venture opportunity screening document that can be developed into a business plan in a subsequent course entitled New Venture Creation or through independent study."
15-392,Special Topic: Secure Programming,Spring,9,"This course provides a detailed explanation of common programming errors  in C and C++ and describes how these errors can lead to software systems  that are vulnerable to exploitation. The course concentrates on security  issues intrinsic to the C and C++ programming languages and associated  libraries. It does not emphasize security issues involving interactions  with external systems such as databases and web servers, as these are  rich topics on their own. Topics to be covered include the secure and  insecure use of integers, arrays, strings, dynamic memory, formatted  input/output functions, and file I/O.Prerequisite: 15-213 Min. grade C Course Website: https://www.securecoding.cert.org/confluence/display/sci/15392+Secure+Programming"
15-400,Research Practicum in Computer Science,Spring,12,"This Spring course is the second part of a two-course sequence that is designed to help prepare students to invent the future state-of-the-art in the field of computer science.  Building directly upon 15-300 (the prerequisite for this course), students will conduct a semester-long independent research project, under the guidance of both the course staff and a faculty project mentor.  The course does not meet for lecture or recitations.  Instead, the students will spend their time working on their research projects, and will also meet with course staff on a bi-weekly basis to discuss their progress.  Students will prepare a written report and a poster presentation at the end of the semester to describe what they have accomplished.Prerequisite: 15-300 Min. grade C"
15-405,Engineering Distributed Systems,Spring,9,"This is a course for students with strong design and implementation skills who are likely to pursue careers as software architects and lead engineers.  It may be taken by well-prepared undergraduates with excellent design and implementation skills in low-level systems programing.  The course assumes a high level of proficiency in all aspects of operating system design and implementation.  This course will help students prepare for leadership roles in creating and evolving the complex, large-scale computer systems that society will increasingly depend on in the future.  The course will teach the organizing principles of such systems, identifying a core set of versatile techniques that are applicable across many system layers. Students will acquire the knowledge base, intellectual tools, hands-on skills and modes of thought needed to build well-engineered computer systems that withstand the test of time, growth in scale, and stresses of live use.   Topics covered include: caching, prefetching, damage containment, scale reduction, hints, replication, hash-based techniques, and fragmentation reduction.  A substantial project component is an integral part of the course.  A high level of proficiency in systems programming is expected. If you do not have the 15-410 prerequisite you will need to get approval from the faculty.Prerequisite: 15-410 Min. grade B"
15-410,Operating System Design and Implementation,Fall and Spring,15,"Operating System Design and Implementation is a rigorous hands-on introduction to the principles and practice of operating systems. The core experience is writing a small Unix-inspired OS kernel, in C with some x86 assembly language, which runs on a PC hardware simulator (and on actual PC hardware if you wish).  Work is done in two-person teams, and ""team programming"" skills (source control, modularity, documentation) are emphasized.  The size and scope of the programming assignments typically result in students significantly developing their design, implementation, and debugging abilities. Core concepts include the process model, virtual memory, threads, synchronization, and deadlock; the course also surveys higher-level OS topics including file systems, interprocess communication, networking, and security.  Students, especially graduate students, who have not satisfied the prerequisite at Carnegie Mellon are strongly cautioned - to enter the class you must be able to write a storage allocator in C, use a debugger, understand 2's-complement arithmetic, and translate between C and x86 assembly language.  The instructor may require you to complete a skills assessment exercise before the first week of the semester in order to remain registered in the class.  Auditing:  this course is usually full, and we generally receive many more requests to audit than we can accept.  If you wish to audit, please have your advisor contact us before the semester begins to discuss your educational goals.Prerequisite: 15-213 Min. grade C"
15-411,Compiler Design,Fall,15,"This course covers the design and implementation of compiler and run-time systems for high-level languages, and examines the interaction between language design, compiler design, and run-time organization. Topics covered include syntactic and lexical analysis, handling of user-defined types and type-checking, context analysis, code generation and optimization, and memory management and run-time organization.Prerequisite: 15-213 Min. grade C Course Website: http://symbolaris.com/course/compiler12.html"
15-412,Operating System Practicum,Fall,0,"The goal of this class is for students to acquire hands-on experience with operating-system code as it is developed and deployed in the real world.  Groups of two to four students will select, build, install, and become familiar with an open-source operating system project; propose a significant extension or upgrade to that project; and develop a production-quality implementation meeting the coding standards of that project.  Unless infeasible, the results will be submitted to the project for inclusion in the code base.  Variations on this theme are possible at the discretion of the instructor.  For example, it may be possible to work within the context of a non-operating-system software infrastructure project (window system, web server, or embedded network device kernel) or to extend a 15-410 student kernel.  In some situations students may work alone.  Group membership and unit count (9 units versus 12) will be decided by the third week of the semester.  Contributing to a real-world project will involve engaging in some mixture of messy, potentially open-ended activities such as: learning a revision control system, writing a short design document, creating and updating a simple project plan, participating in an informal code review, synthesizing scattered information about hardware and software, classifying and/or reading large amounts of code written by various people over a long period of time, etc.Prerequisite: 15-410"
15-413,Software Engineering Practicum,Spring,12,"This course is a project-based course in which students conduct a semester-long project for a real client in small teams. The project defines real world needs for the client in their company. This is not a lecture-based course; after the first few weeks the course consists primarily of weekly team meetings with the course instructors, with teams making regular presentations on their software development process. Teams will give presentations and deliver documents on topics such as:          risk management          project planning          requirements          architecture          detailed design          quality assurance          final product presentations          reflections on the experience  Evaluation will be based on the in-class presentations, process and project documentation, how well the teams follow software engineering (SE) practices, and the client's satisfaction with the product. Individual grades will be influenced by peer reviews, individual reflection documents, mentor impressions, and presentation performance. Students will leave the course with a firsthand understanding of the software engineering realities that drive SE practices, will have concrete experience with these practices, and will have engaged in active reflection on this experience. They will have teamwork, process, and product skills to support immediate competency in a software engineering organization, along with a deeper understanding that prepares them to evaluate the new processes and techniques they will encounter in the workplace."
15-414,Bug Catching: Automated Program Verification and Testing,Intermittent,9,"Many CS and ECE students will be developing software and hardware that must be ultra reliable at some point in their careers. Logical errors in such designs can be costly, even life threatening. There have already been a number of well publicized errors like the Intel Pentium floating point error and the Arian 5 crash. In this course we will study tools for finding and preventing logical errors. Three types of tools will be studied: automated theorem proving, state exploration techniques like model checking and tools based on static program analysis. Although students will learn the theoretical basis for such tools, the emphasis will be on actually using them on real examples.  This course can be used to satisfy the Logic & Languages requirement for the Computer Science major.Prerequisites: 15-122 Min. grade C and 15-251 Min. grade C"
15-415,Database Applications,Fall,12,"This course covers the fundamental topics for Database Management  Systems: Database System Architectural Principles (ACID properties; data abstraction; external, conceptual, and internal schemata; data  independence; data definition and data manipulation languages), Data  models (entity-relationship and relational data models; data  structures, integrity constraints, and operations for each data  model; relational query languages: SQL, algebra, calculus), Theory of  database design (functional dependencies; normal forms; dependency  preservation; information loss), Query Optimization (equivalence of  expressions, algebraic manipulation; optimization of selections and  joins), Storage Strategies (indices, B-trees, hashing), Query Processing (execution of sort, join, and aggregation operators), and Transaction Processing (recovery and concurrency control).Prerequisites: 15-210 Min. grade C and 15-213 Min. grade C Course Website: http://15415.courses.cs.cmu.edu/"
15-417,HOT Compilation,Intermittent,12,"The course covers the implementation of compilers for higher-order, typed languages such as ML and Haskell, and gives an introduction to type-preserving compilation.  Topics covered include type inference, elaboration, CPS conversion, closure conversion, garbage collection, phase splitting, and typed assembly language.Prerequisites: 15-312 or 15-317"
15-418,Parallel Computer Architecture and Programming,Spring,12,"The fundamental principles and engineering tradeoffs involved in designing modern parallel computers, as well as the programming techniques to effectively utilize these machines. Topics include naming shared data, synchronizing threads, and the latency and bandwidth associated with communication. Case studies on shared-memory, message-passing, data-parallel and dataflow machines will be used to illustrate these techniques and tradeoffs. Programming assignments will be performed on one or more commercial multiprocessors, and there will be a significant course project.Prerequisite: 15-213 Min. grade C"
15-421,Information Security and Privacy,Fall,12,"As layers upon layers of technology mediate our activities, issues of information security and privacy are becoming increasingly pervasive and complex. This course takes a multi-disciplinary perspective of information security and privacy, looking at technologies as well as business, legal, policy and usability issues. The objective is to prepare students to identify and address critical security and privacy issues involved in the design, development and deployment of robust computer and information systems. Examples used to introduce concepts covered in the class range from enterprise systems to mobile computing, the Internet of Things, social networking and digital currencies. Topics Covered: Information Security and Privacy: the big picture; A gentle introduction to cryptography; Certificates, PKI, Decentralized Trust Management;  Authentication; Internet Security protocols; Risk management; Trusted Computing; Systems security; Web attacks; Cybercrime; Understanding the cyber security legal landscape; Information Privacy: Fundamental concepts & legal landscape; Privacy and Big Data; Privacy Enhancing Technologies; Privacy Engineering; Usable Security and Privacy; Electronic payments and digital currencies; Emerging Security and Privacy challenges (e.g. Cloud Security and Privacy, Mobile and IoT Security and Privacy, Social Networking Security and Privacy)Prerequisites: 76-101 and 15-112Course Website: http://www.normsadeh.com/isp-content"
15-423,Special Topic: Digital Signal Processing for Computer Science,Spring,12,"Digital signals comprise a large fraction of the data analyzed by computer scientists. Sound, e.g. speech and music, images, radar and many other signal types that were conventionally considered to be the domain of the Electrical engineer are now also in the domain of computer scientists, who must analyze them, make inferences, and develop machine learning techinques to analyze, classify and reconstruct such data. In this course we will cover the basics of Digital Signal Processing. We will concentrate on the basic mathematical formulations, rather than in-depth implementation details. We will cover the breadth of topics, beginning with the basics of signals and their representations, the theory of sampling, important transform representations, key processing techniques, and spectral estimation.Prerequisites: (15-112 Min. grade C or 15-122 Min. grade C) and (15-359 or 21-325 or 36-217 or 36-225 or 36-625)"
15-424,Foundations of Cyber-Physical Systems,Intermittent,12,"Cyber-physical systems (CPSs) combine cyber effects (computation and/or communication) with physical effects (motion or other physical processes). Designing algorithms to control CPSs, such as those in cars, aircraft and robots, is challenging due to their tight coupling with physical behavior. At the same time, it is vital that these algorithms be correct, since we rely on CPSs for safety-critical tasks like keeping aircraft from colliding.  Students in this course will understand the core principles behind CPSs, develop models and controls, identify safety specifications and critical properties of CPSs, understand abstraction and system architectures, learn how to design by invariant, reason rigorously about CPS models, verify CPS models of appropriate scale, understand the semantics of a CPS model and develop an intuition for operational effects. Students will write hybrid programs (HPs), which capture relevant dynamical aspects of CPSs in a simple programming language with a simple semantics, allowing the programmer to refer to real-valued variables representing real quantities and specify their dynamics as part of the HP.Prerequisites: 15-122 Min. grade C and 21-122 Min. grade C and (21-241 Min. grade C or 18-202 Min. grade C or 15-251 Min. grade C) Course Website: http://lfcps.org/course/fcps17.html"
