11-731,Machine Translation and Sequence-to-Sequence Models,Spring,12,"Instructors: Graham Neubig.  Prerequisites: This course has no official pre-requisites, although 11-711 ""Algorithms for NLP"" or 10-701 ""Machine Learning"" would be helpful. Course Description:  Machine Translation and Sequence-to-Sequence Models is an introductory graduate-level course surveying the primary approaches and methods for developing systems to translate between human languages, or other sequential data.  The main objective of the course is to obtain basic understanding and implementation skills for modern methods for MT and sequence transduction, including how to design models, how to learn the model parameters, how to search for the best output, and how to create training data. The course will focus on machine translation, but also briefly cover tasks such as dialog response generation, image caption generation, and others."
11-741,Machine Learning for Text Mining,Fall and Spring,12,"This course studies the theory, design, and implementation of text-based information systems. The Information Retrieval core components of the course include statistical characteristics of text, representation of information needs and documents, several important retrieval models (Boolean, vector space, probabilistic, inference net, language modeling), clustering algorithms, automatic text categorization, and experimental evaluation. The software architecture components include design and implementation of high-capacity text retrieval and text filtering systems. A variety of current research topics are also covered, including cross-lingual retrieval, document summarization, machine learning, topic detection and tracking, and multi-media retrieval.      Prerequisites:      Programming and data-structures at the level of 15-212 or higher.  Algorithms comparable to the undergraduate CS algorithms course (15-451) or higher.  Basic linear algebra (21-241 or 21-341).   Basic statistics (36-202) or higher."
11-751,Speech Recognition and Understanding,All Semesters,12,"The technology to allow humans to communicate by speech with machines or by which machines can understand when humans communicate with each other is rapidly maturing. This course provides an introduction to the theoretical tools as well as the experimental practice that has made the field what it is today. We will cover theoretical foundations, essential algorithms, major approaches, experimental strategies and current state-of-the-art systems and will introduce the participants to ongoing work in representation, algorithms and interface design. This course is suitable for graduate students with some background in computer science and electrical engineering, as well as for advanced undergraduates. Prerequisites: Sound mathematical background, knowledge of basic statistics, good computing skills. No prior experience with speech recognition is necessary. This course is primarily for graduate students in LTI, CS, Robotics, ECE, Psychology, or Computational Linguistics. Others by prior permission of instructor."
11-752,"Speech II: Phonetics, Prosody, Perception and Synthesis",Spring,12,"The goal of the course is to give the student basic knowledge from several fields that is necessary in order to pursue research in automatic speech processing. The course will begin with a study of the acoustic content of the speech signal. The students will use the spectrographic display to examine the signal and discover its variable properties. Phones in increasingly larger contexts will be studied with the goal of understanding coarticulation. Phonological rules will be studied as a contextual aid in understanding the spectrographic display. The spectrogram will then serve as a first introduction to the basic elements of prosody. Other displays will then be used to study the three parts of prosody: amplitude, duration, and pitch. Building on these three elements, the student will then examine how the three interact in careful and spontaneous speech.     Next, the students will explore perception. Topics covered will be:   physical aspects of perception, psychological aspects of perception, testing perception processes, practical applications of knowledge about perception.   The second part of this course will cover all aspects of speech synthesis.     Students need only have a basic knoweldge of speech and language processing. Some degree of programming and statistical modelling will be beneficial, but not required.    Taught every other year"
11-761,Language and Statistics,Fall,12,"Language technologies (search, text mining, information retrieval, speech recognition, machine translation, question answering, biological sequence analysis...) are at the forefront of this century's information revolution.  In addition to their use of machine learning, these technologies rely centrally on classic statistical estimation techniques.   Yet most CS and engineering undergraduate programs do not prepare students in this area beyond an introductory prob&stats course.  This course is designed to plug this hole.  The goal of ""Language and Statistics"" is to ground the data-driven techniques used in language technologies in sound statistical methodology.   We start by formulating various language technology problems in both an information theoretic framework (the source-channel paradigm) and a Bayesian framework (the Bayes classifier).  We then discuss the statistical properties of words, sentences, documents and whole languages, and the computational formalisms used to represent language.  These discussions naturally lead to specific concepts in statistical estimation.  Topics include: Zipf's distribution and type-token curves; point estimators, Maximum Likelihood estimation, bias and variance, sparseness, smoothing and clustering; interpolation, shrinkage, and backoff; entropy, cross entropy and mutual information;  decision tree models applied to language; latent variable models and the EM algorithm; hidden Markov models; exponential models and maximum entropy; semantic modeling and dimensionality reduction; probabilistic context-free grammars and syntactic language models.  The course is designed for LTI & SCS graduate students, but others are welcome.  CS UG upperclassmen who've taken it have done well, though they found it challenging.  The 11-661 version does not require the course project.  Prerequisites: Strong quantitative aptitude.  Comfort with basic UG-level probability.  Some programming skill. Course Website: http://www.cs.cmu.edu/~roni/11761/"
11-762,Language and Statistics II,Fall,12,"This course will cover modern empirical methods in natural language processing. It is designed for language technologies  students who want to understand statistical methodology in the language domain, and for machine learning students who want to know about current problems and solutions in text processing. Students will, upon completion, understand how statistical modeling and learning can be applied to text, be able to develop and apply new statistical models for problems in their own research, and be able to critically read papers from the major related conferences (EMNLP and ACL). A recurring theme will be the tradeoffs between computational cost, mathematical elegance, and applicability to real problems. The course will be organized around methods, with concrete tasks introduced throughout.    The course is designed for SCS graduate students. Prerequisite: Language and Statistics (11-761) or permission of the instructor. Recommended: Algorithms for Natural Language Processing (11-711), Machine Learning (15-681, 15-781, or 11-746).Prerequisite: 11-761"
11-792,Intelligent Information Systems Project,Spring,12,"The Software Engineering for IS sequence combines classroom material and assignments in the fundamentals of software engineering (11-791) with a self-paced, faculty-supervised directed project (11-792). The two courses cover all elements of project design, implementation, evaluation, and  documentation. Students may elect to take only 11-791; however, if both parts are taken, they should be taken in proper sequence. Prerequisite: 11-791. The course is required for VLIS students.Prerequisites: 15-393 or 11-791"
11-927,MIIS Capstone Project,Fall,36,"The capstone project course is a group-oriented demonstration of student skill in one or more areas covered by the degree. Typically the result of the capstone project is a major software application. The capstone project course consists of two components.  The classroom component guides students in project planning, team management, development of requirements and design specifications, and software tools for managing group-oriented projects.  The lab component provides project-specific technical guidance and expertise, for example in the development of a question answering system, dialog, or sentiment analysis application.  Thus, each project receives two types of supervision, often from two separate members of the faculty."
10-401,Introduction to Machine Learning (Undergrad),Fall and Spring,12,"Machine learning is subfield of computer science with the goal of exploring, studying, and developing learning systems, methods, and algorithms that can improve their performance with learning from data. This course is designed to give undergraduate students a one-semester-long introduction to the main principles, algorithms, and applications of machine learning.   Topics. The topics of this course will be in part parallel with those covered in the graduate machine learning courses (10-715, 10-701, 10-601), but with a greater emphasis on applications and case studies in machine learning.  After completing the course, students will be able to:  *select and apply an appropriate supervised learning algorithm for classification problems (e.g., naive Bayes, perceptron, support vector machine, logistic regression).   *select and apply an appropriate supervised learning algorithm for regression problems (e.g., linear regression, ridge regression).  *recognize different types of unsupervised learning problems, and select and apply appropriate algorithms (e.g., clustering, linear and nonlinear dimensionality reduction).   *work with probabilities (Bayes rule, conditioning, expectations, independence), linear algebra (vector and matrix operations, eigenvectors, SVD), and calculus (gradients, Jacobians) to derive machine learning methods such as linear regression, naive Bayes, and principal components analysis.   *understand machine learning principles such as model selection, overfitting, and underfitting, and techniques such as cross-validation and regularization.   *implement machine learning algorithms such as logistic regression via stochastic gradient descent, linear regression (using a linear algebra toolbox), perceptron, or k-means clustering.   *run appropriate supervised and unsupervised learning algorithms on real and synthetic data sets and interpret the results.Prerequisites: 15-122 Min. grade C and (21-128 Min. grade C or 21-127 Min. grade C or 15-151 Min. grade C) and (36-217 Min. grade C or 21-325 Min. grade C or 15-359 Min. grade C or 36-225 Min. grade C)"
10-403,Deep Reinforcement Learning & Control,Spring,12,TBD
10-600,Mathematical background for Machine Learning,Fall and Spring,6,"This course was superseded by the two mini-courses, 10-606 and 10-607."
10-601,Introduction to Machine Learning (Master's),Fall and Spring,12,"Machine Learning (ML) develops computer programs that automatically  improve their performance through experience.   This includes learning  many types of tasks based on many types of experience, e.g. spotting  high-risk medical patients, recognizing speech, classifying text  documents, detecting credit card fraud, or driving autonomous vehicles.   10601 covers all or most of: concept learning, decision  trees, neural networks, linear learning, active learning,  estimation & the bias-variance tradeoff, hypothesis testing, Bayesian  learning, the MDL principle, the Gibbs classifier, Naive Bayes, Bayes  Nets & Graphical Models, the EM algorithm, Hidden Markov Models,  K-Nearest-Neighbors and nonparametric learning, reinforcement learning,  bagging, boosting and discriminative training.   Grading will be based on weekly or biweekly assignments (written and/or  programming), a midterm, a final exam, and possibly a project (details  may vary depending on the section).  10601 is recommended for CS Seniors  & Juniors, quantitative Masters students, & non-MLD PhD students.     Prerequisites (strictly enforced): strong quantitative aptitude, college  prob&stats course, and programming proficiency.  For learning to apply  ML practically & effectively, without the above prerequisites, consider  11344/05834 instead. If you are unsure whether you have sufficient mathematical background to do well in this course, you should consider taking the minis 10-606/10-607 Mathematical Background for Machine Learning.   You can evaluate your ability to take the course  via a self-assessment exam at:  https://qna-app.appspot.com/view.html?aglzfnFuYS1hcHByGQsSDFF1ZXN0aW9uTGlzdBiAgICgpO-KCgw ML course comparison: https://goo.gl/mmR2eLPrerequisites: 15-122 Min. grade C and (15-151 Min. grade C or 21-127 Min. grade C) and (36-217 Min. grade C or 21-325 Min. grade C or 15-359 Min. grade C or 36-225 Min. grade C)"
10-605,Machine Learning with Large Datasets,Spring,12,"Large datasets are difficult to work with for several reasons. They are difficult to visualize, and it is difficult to understand what sort of errors and biases are present in them. They are computationally expensive to process, and often the cost of learning is hard to predict - for instance, and algorithm that runs quickly in a dataset that fits in memory may be exorbitantly expensive when the dataset is too large for memory. Large datasets may also display qualitatively different behavior in terms of which learning methods produce the most accurate predictions.  This course is intended to provide a student practical knowledge of, and experience with, the issues involving large datasets. Among the issues considered are: scalable learning techniques, such as streaming machine learning techniques; parallel infrastructures such as map-reduce; practical techniques for reducing the memory requirements for learning methods, such as feature hashing and Bloom filters; and techniques for analysis of programs in terms of memory, disk usage, and (for parallel methods) communication complexity.  The class will include programming assignments, and a one-month short project chosen by the student. The project will be designed to compare the scalability of variant learning algorithms on datasets.  An introductory course in machine learning, like 10-601 or 10-701, is a prerequisite or a co-requisite. If you plan to take this course and 10-601 concurrently please tell the instructor.  The course will include several substantial programming assignments, so an additional prerequisite is 15-211, or 15-214, or comparable familiarity with Java and good programming skills.Prerequisites: 15-210 or 15-214Course Website: http://goo.gl/W2kPqO"
10-606,Mathematical Background for Machine Learning I,Fall and Spring,6,"This course provides a place for students to practice the necessary mathematical background for further study in machine learning ?particularly for taking 10-601 and 10-701. Topics covered include probability, linear algebra (inner product spaces, linear operators), multivariate differential calculus, optimization, and likelihood functions. The course assumes some background in each of the above, but will review and give practice in each. (It does not provide from-scratch coverage of all of the above, which would be impossible in a course of this length.) Some coding will be required: the course will provide practice with translating the above mathematical concepts into concrete programs. The Mathematical Background for Machine Learning sequence is split into two minis, with 10-606 being a prerequisite for 10-607."
10-607,Mathematical Background for Machine Learning II,Fall and Spring,6,"This course provides a place for students to practice the necessary mathematical background for further study in machine learning ?particularly for taking 10-601 and 10-701. Topics covered include probability, linear algebra (inner product spaces, linear operators), multivariate differential calculus, optimization, and likelihood functions. The course assumes some background in each of the above, but will review and give practice in each. (It does not provide from-scratch coverage of all of the above, which would be impossible in a course of this length.) Some coding will be required: the course will provide practice with translating the above mathematical concepts into concrete programs. The Mathematical Background for Machine Learning sequence is split into two minis, with 10-606 being a prerequisite for 10-607.Prerequisite: 10-606"
10-701,Introduction to Machine Learning (PhD),Fall and Spring,12,"Machine learning studies the question ""How can we build computer programs that automatically improve their performance through experience?""   This includes learning to perform many types of tasks based on many types of experience.  For example, it includes robots learning to better navigate based on experience gained by roaming their environments, medical decision aids that learn to predict which therapies work best for which diseases based on data mining of historical health records, and speech recognition systems that learn to better understand your speech based on experience listening to you.  This course is designed to give PhD students a thorough grounding in the methods, mathematics and algorithms needed to do research and applications in machine learning. Students entering the class with a pre-existing working knowledge of probability, statistics and algorithms will be at an advantage, but the class has been designed so that anyone with a strong numerate background can catch up and fully participate. You can evaluate your ability to take the course via a self-assessment exam that will be made available to you  after you register.  If you are interested in this topic, but are not a PhD student, or are a PhD student not specializing in machine learning, you might consider the master's level course on Machine Learning, 10-601.""  This class may be appropriate for MS and undergrad students who are interested in the theory and algorithms behind ML. If you are unsure whether you have sufficient mathematical background to do well in this course, you should consider taking the minis 10-606/10-607 Mathematical Background for Machine Learning.   You can evaluate your ability to take the course via a self-assessment exam at: https://goo.gl/mmR2eLPrerequisites: 15-122 Min. grade C and (21-127 Min. grade C or 15-151 Min. grade C) and (36-225 Min. grade C or 36-217 Min. grade C or 21-325 Min. grade C or 15-359 Min. grade C)"
10-703,Deep Reinforcement Learning & Control,Spring,12,"This course will cover latest advances in Reinforcement Learning and Control, such as, deep Q learning, actor-critic methods, learning and planning, concurrent trajectory optimization and policy learning, inverse reinforcement learning, hierarchical reinforcement learning methods, forward predictive models, deep model predictive control, exploration strategies, adaptive control, applications to deep robotic learning. By the end of the course you should be able to: 1) code up a suitable reinforcement learning method in simulation or on robotic platform for a task 2) identify what are easy and hard problems in RL and learning for robotics  The course will have a final project which will involve design of a reinforcement learning method in simulation or robotic platform. The homeworks will be in OpenAI gym. Pre-requisites: Students should have a basic background in algorithms, linear algebra, machine Learning, deep learning."
10-707,Topics in Deep Learning,Fall,12,"Building intelligent machines that are capable of extracting meaningful representations from high-dimensional data lies at the core of solving many AI related tasks. In the past few years, researchers across many different communities, from applied statistics to engineering, computer science and neuroscience, have developed deep (hierarchical) models ?models that are composed of several layers of nonlinear processing. An important property of these models is that they can learn useful representations by re-using and combining intermediate concepts, allowing these models to be successfully applied in a wide variety of domains, including visual object recognition, information retrieval, natural language processing, and speech perception.  This is an advanced graduate course, designed for Master's and Ph.D. level students, and will assume a reasonable degree of mathematical maturity. The goal of this course is to introduce students to the recent and exciting developments of various deep learning methods. Some topics to be covered include: restricted Boltzmann machines (RBMs) and their multi-layer extensions Deep Belief Networks and Deep Boltzmann machines; sparse coding, autoencoders, variational autoencoders, convolutional neural networks, recurrent neural networks, generative adversarial networks, and attention-based models with applications in vision, NLP, and multimodal learning. We will also address mathematical issues, focusing on efficient large-scale optimization methods for inference and learning, as well as training density models with intractable partition functions.  Prerequisite: ML: 10-701 or 10-715, and strong programming skills.Prerequisites: 10-701 Min. grade C or 10-401 Min. grade C or 10-715 Min. grade C or 10-601 Min. grade C"
10-715,Advanced Introduction to Machine Learning,Fall,12,"The rapid improvement of sensory techniques and processor speed, and the availability of inexpensive massive digital storage, have led to a growing demand for systems that can automatically comprehend and mine massive and complex data from diverse sources.  Machine Learning is becoming the primary mechanism by which information is extracted from Big Data, and a primary pillar that Artificial Intelligence is built upon.  This course is designed for Ph.D. students whose primary field of study is machine learning, or who intend to make machine learning methodological research a main focus of their thesis.  It will give students a thorough grounding in the algorithms, mathematics, theories, and insights needed to do in-depth research and applications in machine learning. The topics of this course will in part parallel those covered in the general graduate machine learning course (10-701), but with a greater emphasis on depth in theory and algorithms.   The course will also include additional advanced topics such as privacy in machine learning, interactive learning, reinforcement learning, online learning,  Bayesian nonparametrics, and additional material on graphical models.  Students entering the class are expected to have a pre-existing strong working knowledge of algorithms, linear algebra, probability, and statistics.  If you are interested in this topic, but do not have the required background or are not planning to work on a PhD thesis with machine learning as the main focus, you might consider the general graduate Machine Learning course (10-701) or the Masters-level Machine Learning course (10-601). ML course comparison: https://goo.gl/mmR2eL Course Website: https://sites.google.com/site/107152016f/"
10-806,Foundations of Machine Learning and Data Science,Fall,12,"This course will cover fundamental topics in Machine Learning and Data Science, including powerful algorithms with provable guarantees for making sense of and generalizing from large amounts of data.  The course will start by providing a basic arsenal of useful statistical and computational tools, including generalization guarantees, core algorithmic methods, and fundamental analysis models.  We will examine questions such as: Under what conditions can we hope to meaningfully generalize from limited data?  How can we best combine different kinds of information such as labeled and unlabeled data, leverage multiple related learning tasks, or leverage multiple types of features?  What can we prove about methods for summarizing and making sense of massive datasets, especially under limited memory?  We will also examine other important constraints and resources in data science including privacy, communication, and taking advantage of limited interaction.  In addressing these and related questions we will make connections to statistics, algorithms, linear algebra, complexity theory, information theory, optimization, game theory, and empirical machine learning research.  Topics to be covered will include: - Fundamental measures of complexity for generalization, including   VC-dimension and Rademacher complexity. - Core algorithmic tools including boosting, regularization, and   online optimization with connections to game theory. - Spectral methods, streaming algorithms and other approaches for   handling massive data. - Foundations and algorithms for addressing important constraints or   externalities such as privacy, limited memory, and communication   constraints. - Foundations for modern learning paradigms including semi-supervised   learning, never-ending learning, interactive learning, and deep   learning. Course Website: http://www.cs.cmu.edu/~ninamf/courses/806/10-806-index.html"
