02-201,Programming for Scientists,Fall and Spring,10,"Provides a practical introduction to programming for students with little or no prior programming experience who are interested in science. Fundamental scientific algorithms will be introduced, and extensive programming assignments will be based on analytical tasks that might be faced by scientists, such as parsing,  simulation, and optimization.  Principles of good software engineering will also be stressed. The course will introduce students to the Go programming language, an industry-supported, modern programming language, the syntax of which will be covered in depth. Other assignments will be given in other programming languages such as Python and Java to highlight the commonalities and differences between languages. No prior programming experience is assumed, and no biology background is needed. Analytical skills and mathematical maturity are required. Course not open to CS majors."
02-223,Personalized Medicine: Understanding Your Own Genome,Fall,9,"Do you want to know how to discover the tendencies hidden in your genome? Since the first draft of a human genome sequence became available at the start of this century, the cost of genome sequencing has decreased dramatically. Personal genome sequencing will likely become a routine part of medical exams for patients for prognostic and diagnostic purposes. Personal genome information will also play an increasing role in lifestyle choices, as people take into account their own genetic tendencies. Commercial services such as 23andMe have already taken first steps in this direction. Computational methods for mining large-scale genome data are being developed to unravel the genetic basis of diseases and assist doctors in clinics. This course introduces students to biological, computational, and ethical issues concerning use of personal genome information in health maintenance, medical practice, biomedical research, and policymaking. We focus on practical issues, using individual genome sequences (such as that of Nobel prize winner James Watson) and other population-level genome data. Without requiring any background in biology or CS, we begin with an overview of topics from genetics, molecular biology, stats, and machine learning relevant to the modern personal genome era. We then cover scientific issues such as how to discover your genetic ancestry and how to learn from genomes about migration and evolution of human populations. We discuss medical aspects such as how to predict whether you will develop diseases such as diabetes based on your own genome, how to discover disease-causing genetic mutations, and how genetic information can be used to recommend clinical treatments."
02-250,Introduction to Computational Biology,Spring,12,"This 12-unit class provides a general introduction to computational tools for biology. The course is divided into two modules. Module 1 covers computational molecular biology/genomics. It examines important sources of biological data, how they are archived and made available to researchers, and what computational tools are available to use them effectively in research. In the process, it covers basic concepts in statistics, mathematics, and computer science needed to effectively use these resources and understand their results. Specific topics covered include sequence data, searching and alignment, structural data, genome sequencing, genome analysis, genetic variation, gene and protein expression, and biological networks and pathways. Module 2 covers computational cell biology, including biological modeling and image analysis. It includes homework assignments requiring modification of scripts to perform computational analyses. The modeling component includes computer models of population dynamics, biochemical kinetics, cell pathways, neuron behavior, and stochastic simulations. The imaging component includes basics of machine vision, morphological image analysis, image classification and image-derived models. Lectures and examinations are joint with 03-250, but recitations are separate. Recitations for this course are intended primarily for computational biology majors as well as computer science, statistics or engineering majors at the undergraduate or graduate level who have had significant prior experience with computer science or programming. Students may not take both 02-250 and 03-250 for credit.Prerequisites: 15-110 or 15-112 or 02-201"
02-261,Quantitative Cell and Molecular Biology Laboratory,Fall and Spring,9,"This is an introductory laboratory-based course designed to teach basic biological laboratory skills used in exploring the quantitative nature of biological systems and the reasoning required for performing research in computational biology. Over the course of the semester, students will design and perform multiple modern experiments and quantitatively analyze the results of these experiments. During this course students will also have an opportunity to use techniques learned during the course to experimentally answer an open question.  Designing the experiments will require students to think critically about the biological context of the experiments as well as the necessary controls to ensure interpretable experimental results.  During this course students will gain experience in many aspects of scientific research, including: sequencing DNA, designing and performing PCR for a variety of analyses, maintaining cell cultures, taking brightfield and fluorescent microscopy images, developing methods for automated analysis of cell images, communicating results to peers and colleagues. As space is limited, laboratory sections will be small. Additional sections will be added to accommodate all students on the waitlist. Course Outline: (1) 3-hour lab per week, (1) 1-hour lecture per week."
02-317,Algorithms in Nature,Intermittent,9,"Computer systems and biological processes often rely on networks of interacting entities to reach joint decisions, coordinate and respond to inputs. There are many similarities in the goals and strategies of biological and computational systems which suggest that each can learn from the other. These include the distributed nature of the networks (in biology molecules, cells, or organisms often operate without central control), the ability to successfully handle failures and attacks on a subset of the nodes, modularity and the ability to reuse certain components or sub-networks in multiple applications and the use of stochasticity in biology and randomized algorithms in computer science. In this course we will start by discussing classic biologically motivated algorithms including neural networks (inspired by the brain), genetic algorithms (sequence evolution), non-negative matrix factorization (signal processing in the brain), and search optimization (ant colony formation). We will then continue to discuss more recent bi-directional studies that have relied on biological processes to solve routing and synchronization problems, discover Maximal Independent Sets (MIS), and design robust and fault tolerant networks. In the second part of the class students will read and present new research in this area. Students will also work in groups on a final project in which they develop and test a new biologically inspired algorithm.  No prior biological knowledge required.Prerequisites: 15-210 and 15-251Course Website: http://www.algorithmsinnature.org"
02-319,Genomics and Epigenetics of the Brain,Fall,9,"This course will provide an introduction to genomics, epigenetics, and their application to problems in neuroscience. The rapid advances in genomic technology are in the process of revolutionizing how we conduct molecular biology research. These new techniques have given us an appreciation for the role that epigenetics modifications of the genome play in gene regulation, development, and inheritance. In this course, we will cover the biological basis of genomics and epigenetics, the basic computational tools to analyze genomic data, and the application of those tools to neuroscience. Through programming assignments and reading primary literature, the material will also serve to demonstrate important concepts in neuroscience, including the diversity of neural cell types, neural plasticity, the role that epigenetics plays in behavior, and how the brain is influenced by neurological and psychiatric disorders. Although the course focuses on neuroscience, the material is accessible and applicable to a wide range of topics in biology. 02-250 is a suggested pre-requisite.Prerequisites: (03-151 or 03-121) and 03-220 and (15-110 or 02-201 or 15-121)"
02-402,Computational Biology Seminar,Fall and Spring,3,This course consists of weekly invited presentations on current computational biology research topics by leading scientists.  Students will be expected to digest what they have learned in the seminar by writing short summaries on each speaker's topic.
02-403,Special Topics in Bioinformatics and Computational Biology,Intermittent,6,"A decade ago, mass spectrometry (MS) was merely a qualitative research technique allowing the analysis of samples regarding the presence of specific biomolecules.  However, as MS has turned quantitative, more sophisticated experiments can be performed, such as the recording of signal transduction kinetics and the analysis of the composition of protein complexes and organelles.  This makes MS-based proteomics a powerful method to study spatiotemporal protein dynamics. The development of relative quantification approaches, which generally use 2H, 13C or 15N isotope labels, has especially led to an increase in quantification accuracy and set off numerous new experimental approaches to study protein regulation. In this mini-course, we will cover mass spectrometry principles, discuss classical as well as current primary literature addressing method development and quantitative analysis, and highlight state-of-the-art biological studies that employ MS. A combination of lectures, student presentations, and written exercises will establish a thorough knowledge of current bio-analytical MS approaches.Prerequisites: (02-250 Min. grade C or 03-250 Min. grade C) and 03-121 Min. grade C"
02-421,Algorithms for Computational Structural Biology,Intermittent,12,"Some of the most interesting and difficult challenges in computational biology and bioinformatics arise from the determination, manipulation, or exploitation of molecular structures. This course will survey these challenges and present a variety of computational methods for addressing them. Topics will include:  molecular dynamics simulations, computer-aided drug design, and computer-aided protein design. The course is appropriate for both students with backgrounds in computer science and those in the life sciences."
02-425,Computational Methods for Proteomics and Metabolomics,Spring,9,"Proteomics and metabolomics are the large scale study of proteins and metabolites, respectively.  In contrast to genomes, proteomes and metabolomes vary with time and the specific stress or conditions an organism is under. Applications of proteomics and metabolomics include determination of protein and metabolite functions (including in immunology and neurobiology) and discovery of biomarkers for disease. These applications require advanced computational methods to analyze experimental measurements, create models from them, and integrate with information from diverse sources.  This course specifically covers computational mass spectrometry, structural proteomics, proteogenomics, metabolomics, genome mining and metagenomics.  Prerequisites: 02-250 or 02-604.Prerequisites: 02-250 or 02-604"
02-450,Automation of Biological Research: Robotics and Machine Learning,Fall,9,"Biology is increasingly becoming a ""big data"" science, as biomedical research has been revolutionized by automated methods for generating large amounts of data on diverse biological processes. Integration of data from many types of experiments is required to construct detailed, predictive models of cell, tissue or organism behaviors, and the complexity of the systems suggests that these models need to be constructed automatically. This requires iterative cycles of acquisition, analysis, modeling, and experimental design, since it is not feasible to do all possible biological experiments. This course will cover a range of automated biological research methods and a range of computational methods for automating the acquisition and interpretation of the data (especially active learning, proactive learning, compressed sensing and model structure learning). Grading will be based on class participation, homeworks, and a final project. The course is designed for graduate and upper-level undergraduate students with a wide variety of backgrounds. The course is intended to be self-contained but students may need to do some additional work to gain fluency in core concepts. Students should have a basic knowledge of biology, statistics, and programming. Experience with Machine Learning is useful but not mandatory.Prerequisites: 15-122 and 10-401Course Website: https://sites.google.com/site/automationofbiologicalresearch/"
02-499,Independent Study in Computational Biology,Fall and Spring,0,"The student will, under the individual guidance of a faculty member, read and digest process papers or a textbook in an advanced area of computational biology not offered by an existing course at Carnegie Mellon.  The student will demonstrate their mastery of the material by a combination of one or more of the following: oral discussions with the faculty member; exercises set by the faculty member accompanying the readings; and a written summary synthesizing the material that the student learned. Permission required."
02-500,Undergraduate Research in Computational Biology,Fall and Spring,0,"This course is for undergraduate students who wish to do supervised research for academic credit with a Computational Biology faculty member.  Interested students should first contact the Professor with whom they would like to work.  If there is mutual interest, the Professor will direct you to the Academic Programs Coordinator and Asst Dept Head for Education."
02-510,Computational Genomics,Fall and Spring,0,"Dramatic advances in experimental technology and computational analysis are fundamentally transforming the basic nature and goal of biological research. The emergence of new frontiers in biology, such as evolutionary genomics and systems biology is demanding new methodologies that can confront quantitative issues of substantial computational and mathematical sophistication. In this course we will discuss classical approaches and latest methodological advances in the context of the following biological problems: 1) sequence analysis, focusing on gene finding and motifs detection, 2) analysis of high throughput molecular data, such as gene expression data, including normalization, clustering, pattern recognition and classification, 3) molecular and regulatory evolution, focusing on phylogenetic inference and regulatory network evolution, 4) population genetics, focusing on how genomes within a population evolve through recombination, mutation, and selection to create various structures in modern genomes and 5) systems biology, concerning how to combine diverse data types to make mechanistic inferences about biological processes. From the computational side this course focuses on modern machine learning methodologies for computational problems in molecular biology and genetics, including probabilistic modeling, inference and learning algorithms, data integration, time series analysis, active learning, etc. This course may be taken for 12 units, which requires completion of a course project, or for 9 units, which does not.Prerequisites: 15-122 Min. grade C and (15-151 Min. grade C or 21-127 Min. grade C or 21-128 Min. grade C)"
02-512,Computational Methods for Biological Modeling and Simulation,Fall,9,"This course covers a variety of computational methods important for modeling and simulation of biological systems. It is intended for graduates and advanced undergraduates with either biological or computational backgrounds who are interested in developing computer models and simulations of biological systems. The course will emphasize practical algorithms and algorithm design methods drawn from various disciplines of computer science and applied mathematics that are useful in biological applications. The general topics covered will be models for optimization problems, simulation and sampling, and parameter tuning. Course work will include problem sets with significant programming components and independent or group final projects.Prerequisites: 02-201 or 15-112 or 15-110"
02-514,String Algorithms,Fall,12,"Provides an in-depth look at modern algorithms used to process string data, particularly those relevant to genomics. The course will cover the design and analysis of efficient algorithms for processing enormous collections of strings. Topics will include string search; inexact matching; string compression; string data structures such as suffix trees, suffix arrays, and searchable compressed indices; and the Burrows-Wheeler transform. Applications of these techniques in biology will be presented, including genome assembly, transcript assembly, whole-genome alignment, gene expression quantification, read mapping, and search of large sequence databases. No knowledge of biology is assumed, and the topics covered will be of use in other fields involving large collections of strings. Programming proficiency is required.Prerequisite: 15-251"
02-518,Computational Medicine,Spring,12,"Modern medical research increasingly relies on the analysis of large patient datasets to enhance our understanding of human diseases. This course will focus on the computational problems that arise from studies of human diseases and the translation of research to the bedside to improve human health. The topics to be covered include computational strategies for advancing personalized medicine, pharmacogenomics for predicting individual drug responses, metagenomics for learning the role of the microbiome in human health, mining electronic medical records to identify disease phenotypes, and case studies in complex human diseases such as cancer and asthma. We will discuss how machine learning methodologies such as regression, classification,  clustering, semi-supervised learning, probabilistic modeling, and time-series modeling are being used to analyze a variety of datasets collected by clinicians. Class sessions will consist of lectures, discussions of papers from the literature, and guest presentations by clinicians and other domain experts. Grading will be based on homework assignments and a project. 02-250 is a suggested pre-requisite.Prerequisites: 10-401 or 10-601"
02-530,Cell and Systems Modeling,Fall,12,"This course will introduce students to the theory and practice of modeling biological systems from the molecular to the organism level with an emphasis on intracellular processes. Topics covered include kinetic and equilibrium descriptions of biological processes, systematic approaches to model building and parameter estimation, analysis of biochemical circuits modeled as differential equations, modeling the effects of noise using stochastic methods, modeling spatial effects, and modeling at higher levels of abstraction or scale using logical or agent-based approaches. A range of biological models and applications will be considered including gene regulatory networks, cell signaling, and cell cycle regulation. Weekly lab sessions will provide students hands-on experience with methods and models presented in class. Course requirements include regular class participation, bi-weekly homework assignments, a take-home exam, and a final project.    Prerequisites: The course is designed for graduate and upper-level undergraduate students with a wide variety of backgrounds.  The course is intended to be self-contained but students may need to do some additional work to gain fluency in core concepts.  Students should have a basic knowledge of calculus, differential equations, and chemistry as well as some previous exposure to molecular biology and biochemistry.  Experience with programming and numerical computation is useful but not mandatory.  Laboratory exercises will use MATLAB as the primary modeling and computational tool augmented by additional software as needed.Prerequisites: (03-121 or 03-151 or 33-121) and (03-231 or 03-232) and 21-112 and 09-105"
02-601,Programming for Scientists,Fall and Spring,12,"Provides a practical introduction to programming for students with little or no prior programming experience who are interested in science. Fundamental scientific algorithms will be introduced, and extensive programming assignments will be based on analytical tasks that might be faced by scientists, such as parsing,  simulation, and optimization. Principles of good software engineering will also be stressed, and students will have the opportunity to design their own programming project on a scientific topic of their choice. The course will introduce students to the Go programming language, an industry-supported, modern programming language, the syntax of which will be covered in depth. Other assignments will be given in other programming languages such as Python and Java to highlight the commonalities and differences between languages. No prior programming experience is assumed, and no biology background is needed. Analytical skills and mathematical maturity are required. Course not open to CS majors."
02-602,Professional Issues in Computational Biology,Fall and Spring,1,"This course gives MS in Computational Biology students an opportunity to develop professional skills necessary for a successful career in computational biology. This course will include assistance with resume writing, interview preparation, presentation skills, and job search techniques. This course will also include opportunities to network with computational biology professionals and academic researchers. This course will meet once a week. This course is pass/fail only. Grading scheme will be discussed on first day of class."
02-604,Fundamentals of Bioinformatics,Spring,12,"How do we find potentially harmful mutations in your genome? How can we reconstruct the Tree of Life? How do we compare similar genes from different species? These are just three of the many central questions of modern biology that can only be answered using computational approaches. This 12-unit course will delve into some of the fundamental computational ideas used in biology and let students apply existing resources that are used in practice every day by thousands of biologists. The course offers an opportunity for students who possess an introductory programming background to become more experienced coders within a biological setting. As such, it presents a natural next course for students who have completed 02-601. 02-250 is a suggested pre-requisite for undergraduates."
02-613,Algorithms and Advanced Data Structures,Fall and Spring,12,"The objective of this course is to study algorithms for general computational problems, with a focus on the principles used to design those algorithms. Efficient data structures will be discussed to support these algorithmic concepts. Topics include: Run time analysis, divide-and-conquer algorithms, dynamic programming algorithms, network flow algorithms, linear and integer programming, large-scale search algorithms and heuristics, efficient data storage and query, and NP-completeness. Although this course may have a few programming assignments, it is primarily not a programming course. Instead, it will focus on the design and analysis of algorithms for general classes of problems. This course is not open to CS graduate students who should consider taking 15-651 instead.  02-250 is a suggested prerequisite for undergraduates."
02-651,New Technologies and Future Markets,Fall,12,"This course focuses on technological trends and how these trends can help  shape or disrupt new and existing markets. Students will learn to identify,  analyze, and synthesize emerging trends and perform detailed research on how  these trends can influence and create markets. By understand the drivers  behind these trends students will be able to identify key market opportunity  inflection points in biotechnology as well as the relationship between  business processes and information technology (IT). Students will also learn  to assess some information technologies and the potential of applying them  to solve problems and create commercially viable solutions.    The course is designed for the student interested in finding new venture  opportunities on the cutting edge of technology and finding and evaluating  the opportunities for further development. For MS Biotechnology Innovation and Computation students only.Prerequisite: 11-695"
