E81 CSE 104,Web Development,"This comprehensive course does not assume prior programming background or web design experience. Explores elementary principles that go into designing, creating and publishing an effective website. Topics include the production process, design metaphors, interface/information design, page layout concepts, graphics preparation, color theory, development tools, HTML, style sheets, basic scripting techniques, search engine optimization and site maintenance/marketing strategies.",
E81 CSE 131,Computer Science I,"An introduction to software concepts and implementation, emphasizing problem solving through abstraction and decomposition. Introduces processes and algorithms, procedural abstraction, data abstraction, encapsulation and object-oriented programming. Recursion, iteration and simple data structures are covered. Concepts and skills are mastered through programming projects, many of which employ graphics to enhance conceptual understanding. Java, an object-oriented programming language, is the vehicle of exploration. Active-learning sessions are conducted in a studio setting in which students interact with each other and the professor to solve problems collaboratively. Prerequisites: Comfort with algebra and geometry at the high school level is assumed. Patience, good planning and organization promote success. This course assumes no prior experience with programming.",
E81 CSE 131R,Seminar: Computer Science I,A seminar and discussion session that complements the material studied in CSE 131. Provides background and breadth for the disciplines of computer science and computer engineering. Features guest lectures and highly interactive discussions of diverse computer science topics. Highly recommended for majors and for any student seeking a broader view of computer science or computer engineering. Pass/Fail only.,
E81 CSE 132,Computer Science II,"CSE 132 introduces students to fundamental concepts in the basic operation of computers, ranging from desktops and servers to microcontrollers and handheld devices. Subjects include digital and analog input/output, sensing the physical world, information representation, basic computer architecture and machine language, time-critical computation, machine-to-machine communication and protocol design. Students will use both desktop systems and handheld microcontrollers for laboratory experiments. Active-learning sessions are conducted in a studio setting in which students interact with each other and the professor to solve problems collaboratively. Prerequisite: CSE 131.",
E81 CSE 141,The Digital Society,"Our modern digital society is both exciting and challenging. As the effectiveness of computing advances, and digital technologies like the internet and algorithmic decision-making affect and penetrate more and more aspects of our lives, we face extraordinary opportunities and equally extraordinary challenges. Computer driven automation increases our quality of life but eradicates our jobs! The internet and smartphones keep us connected but subject us to growing corporate, government and criminal surveillance! In this course, co-taught by professors from the Schools of Engineering and Law, we will examine the fundamental technical underpinnings of digital society and its consequences. We will discuss ""Welcome to the Future,"" ""The Future of Jobs,"" and ""The Future of Humans."" All aspects of life are evolving rapidly in our digital society, and we will draw on expert and engaging guest speakers from all seven schools of Washington University and intellectual leaders from beyond ourcampus to share their perspectives and insights. This course will help students to perceive the modern world in new ways in order to better understand how technological shifts are changing and challenging notions of individual and collective prosperity. Our goal is to give students both the technical understanding of how our new technologies work and the critical skills to evaluate them for themselves as citizens and leaders of our new digital society.",
E81 CSE 222S,Internet of Things,"For a very long time, the Things in our world have lived relatively lonely and single-purposed lives. With the advent of the Internet of Things, we can address, control, and interconnect these formerly isolated devices to create new and interesting applications. In this course we study Bluetooth Low Energy, one of the fundamental networking technologies behind Internet-of-Things devices, and Appcessories, which include smart watches, health monitors, toys and appliances. In addition to learning about the Bluetooth Low Energy protocol and network stack, students gain hands-on experience developing multi-platform solutions that control and communicate with Things using an accompanying app on a mobile device. Students apply their knowledge and skill to develop a project of their choosing using topics from the course. Prerequisite: CSE 132.",
E81 CSE 231S,Introduction to Parallel and Concurrent Programming,"This course explores concepts, techniques, and design approaches for parallel and concurrent programming. We study how to write programs that make use of multiple processors for responsiveness and that share resources reliably and fairly. Parallel programming concepts include task-level, functional, and loop-level parallelism. Concurrent programming concepts include threads, synchronization and locks. We cover how to adapt algorithms to achieve determinism and avoid data races and deadlock. Concepts and skills are acquired through the design and implementation of software projects. Collaboration skills are developed through work performed in small teams. Prerequisite: CSE 131 or equivalent.",
E81 CSE 232,Programming Skills Workshop,"This course provides an overview of practical implementation skills. Topics include compilation and linking, memory management, pointers and references, using code libraries, testing and debugging. Prerequisites: CSE 132.",
E81 CSE 240,Logic and Discrete Mathematics,"Introduces elements of logic and discrete mathematics that allow reasoning about computational structures and processes. Generally, the areas of discrete structures, proof techniques, probability and computational models are covered. Topics typically include propositional and predicate logic; sets, relations, functions and graphs; proof by contradiction, induction and reduction; finite state machines and regular languages; and introduction to discrete probability, expected value and variance. Prerequisite: CSE 131.",
E81 CSE 247,Data Structures and Algorithms,"Study of fundamental algorithms, data structures, and their effective use in a variety of applications. Emphasizes importance of data structure choice and implementation for obtaining the most efficient algorithm for solving a given problem. A key component of this course is worst-case asymptotic analysis, which provides a quick and simple method for determining the scalability and effectiveness of an algorithm. Prerequisite: CSE 240.",
E81 CSE 260M ,Introduction to Digital Logic and Computer Design,"Introduction to design methods for digital logic and fundamentals of computer architecture. Boolean algebra and logic minimization techniques; sources of delay in combinational circuits and effect on circuit performance; survey of common combinational circuit components; sequential circuit design and analysis; timing analysis of sequential circuits; use of computer-aided design tools for digital logic design (schematic capture, hardware description languages, simulation); design of simple processors and memory subsystems; program execution in simple processors; basic techniques for enhancing processor performance; configurable logic devices. Prerequisites: CSE 131.",
E81 CSE 316A,Social Network Analysis,"This course looks at social networks and markets through the eyes of a computer scientist. We will look at questions including, ""Why are acquaintances rather than friends more likely to get us job opportunities?"" and, ""Why do the rich get richer?"" We begin by studying graph theory (allowing us to study the structure) and game theory (allowing us to study the interactions) of social networks and market behavior at the introductory level. Among other topics, we will study auctions, epidemics, and the structure of the internet (including web searches). This course examines the intersection of computer science, economics, sociology, and applied mathematics. Prerequisites: CSE 247 and ESE 326.",
E81 CSE 330S,Rapid Prototype Development and Creative Programming,"This course uses web development as a vehicle for developing skills in rapid prototyping. Students acquire the skills to build a Linux web server in Apache, to write a website from scratch in PHP, to run an SQL database, to perform scripting in Python, to employ the AngularJS web framework, and to develop modern web applications in client-side and server-side JavaScript. The course culminates with a creative project in which students are able to synthesize the course material into a project of their own interest. The course implements an interactive studio format: After a formal presentation of a topic, students develop a related project under the supervision of the instructor. Prerequisite: CSE 131.",
E81 CSE 332S ,Object-Oriented Software Development Laboratory,"Intensive focus on practical aspects of designing, implementing and debugging software, using object-oriented, procedural, and generic programming techniques. The course emphasizes familiarity and proficiency with a wide range of C++ language features through hands-on practice completing studio exercises and lab assignments, supplemented with readings and summary presentations for each session. Prerequisites: CSE 247.",
E81 CSE 341T ,Parallel and Sequential Algorithms,"The course aims to teach how to design, analyze and implement parallel algorithms. The emphasis is on teaching fundamental principles and design techniques that easily transfer over to parallel programming. These techniques include divide and conquer, contraction, the greedy method, etc. Prerequisite: CSE 247.",
E81 CSE 347,Analysis of Algorithms,"Introduces techniques for the mathematical analysis of algorithms, including randomized algorithms and non-worst-case analyses such as amortized and competitive analysis. Introduces the standard paradigms of divide-and-conquer, greedy, and dynamic programming algorithms, as well as reductions. Also provides an introduction to the study of intractability and techniques to determine when good algorithms cannot be designed. Prerequisite: CSE 247.",
E81 CSE 361S ,Introduction to Systems Software,"Introduction to the hardware and software foundations of computer processing systems. This course provides a programmer's perspective of how computer systems execute programs and store information. The course material aims to enable students to become more effective programmers, especially in dealing with issues of performance, portability and robustness. It also serves as a foundation for other system courses, such as compilers, networks, and operating systems, where a deeper understanding of systems-level issues is required. Topics covered include: machine-level code and its generation by optimizing compilers, performance evaluation and optimization, computer arithmetic, memory organization and management, and supporting concurrent computation. Prerequisites: CSE 132.",
E81 CSE 362M,Computer Architecture,"This course explores the interaction and design philosophy of hardware and software for digital computer systems. Topics include: processor architecture, instruction set architecture, Assembly Language, memory hierarchy design, I/O considerations, and a comparison of computer architectures. Prerequisite: CSE 260M.",
E81 CSE 365S,Elements of Computing Systems,"All computers are made up of 0s and 1s. However, the conceptual gap between the 0s and 1s and the day-to-day operation of modern computers is enormously wide. This fast-paced course aims to bridge the divide by starting with simple logic gates and building up the levels of abstraction until one can create games like Tetris. There is no specific programming language requirement, but some experience with programming is needed. Prerequisite: CSE 247.",
E81 CSE 400 ,Independent Study,"Investigation of a topic in computer science and engineering of mutual interest to the student and a mentor. Interested students are encouraged to approach and engage faculty to develop a topic of interest. A form declaring the agreement must be filed in the departmental office. This course carries university credit, but does not count toward a CSE major or minor. To arrange for CSE major or minor credit for independent study, a student must enroll in CSE 400E instead of CSE 400. Consult also: CSE 400E.",
E81 CSE 400E,Independent Study,"Investigation of a topic in computer science and engineering of mutual interest to the student and a mentor. Interested students are encouraged to approach and engage faculty to develop a topic of interest. A form declaring the agreement must be filed in the departmental office. Credit earned for CSE 400E can be counted toward a student's major or minor program, with the consent of the student's adviser. Consult also: CSE 400.",
E81 CSE 417T,Introduction to Machine Learning,"The field of machine learning is concerned with the question of how to construct computer programs that automatically improve with experience. This course is a broad introduction to machine learning, covering the foundations of supervised learning and important supervised learning algorithms. Topics to be covered are the theory of generalization (including VC-dimension, the bias-variance trade-off, validation and regularization) and linear and nonlinear learning models (including linear and logistic regression, decision trees, ensemble methods, neural networks, nearest-neighbor methods, and support vector machines). Prerequisites: CSE 347 (can be taken concurrently), ESE 326 (or Math 3200), Math 233, and Math 309 (can be taken concurrently).",
E81 CSE 422S ,Operating Systems Organization,"Exploration of operating systems as managers of shared resources. Students study algorithms and data structures that support essential operating systems services. Concepts are reinforced through programming exercises and comparative studies. Topics include: proportional sharing and real-time scheduling of processes and threads, I/O facilities, memory management, virtual memory, device management, concurrent programming, and file system organization. Prerequisite: CSE 361S.",
E81 CSE 425S ,Programming Systems and Languages,"A systematic study of the principles, concepts and mechanisms of computer programming languages: their syntax, semantics and pragmatics; the processing and interpretation of computer programs; programming paradigms; and language design. Illustrative examples are selected from a variety of programming language paradigms. Prerequisites: CSE 332S.",
E81 CSE 427S ,Cloud Computing with Big Data Applications,"This course provides a comprehensive introduction to applied parallel computing using the MapReduce programming model facilitating large-scale data management and processing. There will be an emphasis on hands-on experience working with the Hadoop architecture, an open-source software framework written in Java for distributed storage and processing of very large data sets on computer clusters. Further, we will make use of related big data technologies from the Hadoop ecosystem of tools, such as Hive, Impala, and Pig in developing analytics and solving problems faced by enterprises today. Prerequisites: CSE 247, CSE 131 (or solid background in programming with Java), CSE 247, and CSE 330.",
E81 CSE 431S ,Translation of Computer Languages,,
"The theory of language recognition and translation is introduced in support of compiler construction for modern programming languages. Topics include syntactic and semantic analysis, symbol table management, code generation, and runtime libraries. A variety of parsing methods is covered, including top-down and bottom-up. Machine problems culminate in the course project, for which students construct a working compiler. Prerequisites: CSE 240 and CSE 247.",,,
Credit 3 units. EN: TU,,,
E81 CSE 432S Pattern-Oriented Software Design and Development,,,
"Intensive focus on design and implementation of software using design patterns. Particular emphasis on successive refinement based on identification of unresolved design forces at each step of the design process, and on application of patterns to guide design refinement. Design implementations are conducted in Java and C++ in a team setting, with weekly presentations and critiques of design and implementation decisions and outcomes throughout the course. Prerequisites: CSE 332S or graduate standing, and proficiency in Java and C++ software development.",,,
Credit 3 units. EN: TU,,,
E81 CSE 437S Software Engineering Workshop,,,
"An introduction and exploration of concepts and issues related to large-scale software systems development. Areas of exploration include technical complexities, organization issues, and communication techniques for large-scale development. Students participate through teams emulating industrial development. The projects cover the principal system development life-cycle phases from requirements analysis, to software design, and to final implementation. Issues relating to real-time control systems, human factors, reliability, performance, operating costs, maintainability and others are addressed and resolved in a reasonable manner. Prerequisite: junior or senior standing.",,,
Credit 3 units. EN: TU,,,
E81 CSE 438S Mobile Application Development,,,
"Learn how to create iOS apps in the Swift programming language. This course covers a variety of topics in the development of modern mobile applications, with a focus on hands-on projects. Students will create multiple fully-functional apps from scratch. The course emphasizes object-oriented design patterns and real-world development techniques. Time is provided at the end of the course for students to work on a project of the their own interest. Prerequisites: CSE 247.",,,
Credit 3 units. EN: TU,,,
E81 CSE 450A Video Game Programming,,,
"This course teaches the core aspects of a video game developer's toolkit. Students work in groups and with a large game software engine to create and playtest a full-featured video game. Students will explore topics around the design of games through analysis of current games. Students have the opportunity to explore additional topics including graphics, artificial intelligence, networking, physics, and user interface design through their game project. Prerequisite: CSE 3xxS or 4xxS.",,,
Credit 3 units. EN: TU,,,
E81 CSE 452A Computer Graphics,,,
"Introduction to computer graphics. The course covers fundamental concepts, data structures and algorithms related to the construction, display and manipulation of three-dimensional objects. Topics include scan-conversion, basic image processing, transformations, scene graphs, camera projections, local and global rendering, fractals, and parametric curves and surfaces. Students develop interactive graphics programs using C++ language. Prerequisites: CSE 332S and Math 309.",,,
Credit 3 units. EN: TU,,,
E81 CSE 460T Switching Theory,,,
"Advanced topics in switching theory as employed in the synthesis, analysis and design of information processing systems. Combinational techniques: minimization, multiple output networks, state identification and fault detection, hazards, testability and design for test are examined. Sequential techniques: synchronous circuits, machine minimization, optimal state assignment, asynchronous circuits, and built-in self-test techniques. Prerequisite: CSE 260M.",,,
Credit 3 units. EN: TU,,,
E81 CSE 462M Computer Systems Design,,,
"Introduction to modern design practices, including the use of FPGA design methodologies. Students use a commercial CAE/CAD system for VHDL-based design and simulation while designing a selected computation system. Prerequisites: CSE 361S and CSE 362M.",,,
Credit 3 units. EN: TU,,,
E81 CSE 465M Digital Systems Laboratory,,,
"Hardware/software co-design; processor interfacing; procedures for reliable digital design, both combinational and sequential; understanding manufacturers' specifications; use of test equipment. Several single-period laboratory exercises, several design projects, and application of microprocessors in digital design. One lecture and one laboratory period a week. Prerequisites: CSE 260M and CSE 361S.",,,
Same as E35 ESE 465,,,
Credit 3 units. EN: TU,,,
E81 CSE 467S Embedded Computing Systems,,,
"Introduces the issues, challenges and methods for designing embedded computing systems ¡ª systems designed to serve a particular application, which incorporate the use of digital processing devices. Examples of embedded systems include PDAs, cellular phones, appliances, game consoles, automobiles and iPod. Emphasis is given to aspects of design that are distinct to embedded systems. The course examines hardware, software and system-level design. Hardware topics include microcontrollers, digital signal processors, memory hierarchy and I/O. Software issues include languages, run-time environments and program analysis. System-level topics include real-time operating systems, scheduling, power management and wireless sensor networks. Students perform a course project on a real wireless sensor network testbed. Prerequisite: CSE 361S.",,,
Credit 3 units. EN: TU,,,
E81 CSE 473S Introduction to Computer Networks,,,
"A broad overview of computer networking. Topics include history, protocols, Hyper Text Transfer Protocol (HTTP), File Transfer Protocol (FTP), Simple Mail Transfer Protocol (SMTP), Domain Name System (DNS), peer-to-peer (P2P), transport layer design issues, transport layer protocols, Transmission Control Protocol (TCP), User Datagram Protocol (UDP), TCP congestion control, network layer, Internet Protocol version 4 (IPv4), Internet Control Message Protocol (ICMP), Internet Protocol version 6 (IPv6), routing algorithms, routing protocols, Open Shortest Path First (OSPF), Routing Information Protocol (RIP), Border Gateway Protocol (BGP), datalink layer and local area networks carrier sense multiple access with collision detection (CSMA/CD), Ethernet, virtual local area networks (VLANs), Point-to-Point Protocol (PPP), Multi-Protocol Label Switching, wireless and mobile networks, multimedia networking, security in computer networks, cryptography, and network management. Prerequisites: CSE 132 and 247.",,,
Credit 3 units. EN: TU,,,
E81 CSE 483M Introduction to Electronic Instrumentation Design,,,
"This course covers the principles underlying the design of electronic instrumentation systems. As a case study we will design and analyze a complete instrumentation amplifier integrated circuit and discuss topics related to signal conditioning, amplification, filtering, biasing, data conversion, interface design, mixed-signal layout and mixed-signal simulation. Students are expected to work with state-of-the-art circuit simulation and layout tools for their homework and project assignments. Prerequisites: CSE 260 and ESE 232.",,,
Credit 3 units. EN: TU,,,
E81 CSE 497 Senior Project I,,,
"Implementation of a substantive project on an individual basis, involving one or more major areas in computer science. Problems pursued under this framework may be predominantly analytical, involving exploration and extension of theoretical structures, or may pivot around the design/development of solutions for particular applications drawn from areas throughout the University and/or community. In either case, the project serves as a focal point for crystallizing the concepts, techniques and methodologies encountered throughout the curriculum. Students intending to take CSE 497-498 must submit a project proposal for approval by the department during the spring semester of the junior year. Prerequisite: senior standing.",,,
Credit 3 units.,,,
E81 CSE 498 Senior Project II,,,
"Implementation of a substantive project on an individual basis, involving one or more major areas in computer science. Problems pursued under this framework may be predominantly analytical, involving exploration and extension of theoretical structures, or may pivot around the design/development of solutions for particular applications drawn from areas throughout the University and/or community. In either case, the project serves as a focal point for crystallizing the concepts, techniques and methodologies encountered throughout the curriculum. Students intending to take CSE 497-498 must submit a project proposal for approval by the department during the spring semester of the junior year. Prerequisite: senior standing.",,,
Credit 3 units.,,,
E81 CSE 499 Undergraduate Honors Thesis,,,
"Working closely with a faculty member, the student investigates an original idea (algorithm, model technique, etc.), including a study of its possible implications, its potential application and its relationship to previous related work reported in the literature. Contributions and results from this investigation are synthesized and compiled into a publication-quality research paper presenting the new idea. Prerequisites: a strong academic record and permission of instructor.",,,
Credit 3 units.,,,
E81 CSE 500 Independent Study,,,
"Credit variable, maximum 3 units.",,,
E81 CSE 501N Programming Concepts and Practice,,,
